{
  "schema_version": "class2-mock-view-v1",
  "data_version": "synthetic-fixture-v1",
  "policy_version": "development-unapproved",
  "synthetic": true,
  "development_notice": "DEVELOPMENT ONLY — synthetic fixture; not production or medical-device data.",
  "view_state": "results",
  "release_status": "released",
  "selection_summary": {
    "selections": [
      { "type": "item_group", "id": "synthetic:item-group:alpha", "label": "SYNTHETIC_ITEM_GROUP_ALPHA" },
      { "type": "item_name", "id": "synthetic:item-name:beta", "label": "SYNTHETIC_ITEM_NAME_BETA" }
    ],
    "period": { "start_month": "2099-01", "end_month": "2099-03" }
  },
  "per_item_results": [
    {
      "selection_id": "synthetic:item-group:alpha",
      "selection_type": "item_group",
      "release_status": "released",
      "notice": "Development-only released-state placeholder.",
      "released_content": {
        "activity_label": "SYNTHETIC_ACTIVITY_DISPLAY",
        "quantity_label": "SYNTHETIC_PER_ITEM_QUANTITY_DISPLAY",
        "trend_label": "SYNTHETIC_MONTHLY_TREND_DISPLAY"
      }
    },
    {
      "selection_id": "synthetic:item-name:beta",
      "selection_type": "item_name",
      "release_status": "released",
      "notice": "Development-only released-state placeholder.",
      "released_content": {
        "activity_label": "SYNTHETIC_ACTIVITY_DISPLAY",
        "quantity_label": "SYNTHETIC_PER_ITEM_QUANTITY_DISPLAY",
        "trend_label": "SYNTHETIC_MONTHLY_TREND_DISPLAY"
      }
    }
  ],
  "portfolio_summary": {
    "release_status": "released",
    "notice": "Development-only portfolio composition placeholder.",
    "released_composition": {
      "entries": [
        { "selection_id": "synthetic:item-group:alpha", "share_label": "SYNTHETIC_COMPOSITION_DISPLAY" },
        { "selection_id": "synthetic:item-name:beta", "share_label": "SYNTHETIC_COMPOSITION_DISPLAY" }
      ],
      "non_additive_notice": "Per-item quantities and concentration indicators are not combined."
    }
  },
  "observed_reach": {
    "release_status": "released",
    "notice": "Observed-reach structure placeholder; not a final-destination claim.",
    "released_stages": [
      { "stage_label": "SYNTHETIC_STAGE_ORIGIN", "display_label": "SYNTHETIC_REACH_DISPLAY" },
      { "stage_label": "SYNTHETIC_STAGE_NEXT", "display_label": "SYNTHETIC_REACH_DISPLAY" }
    ]
  },
  "coverage": {
    "release_status": "released",
    "field_states": [
      { "field": "reported_activity", "state": "available", "notice": "Synthetic availability marker." },
      { "field": "raw_supply_quantity", "state": "available", "notice": "Synthetic availability marker." },
      { "field": "supplier_recipient_counts", "state": "available", "notice": "Synthetic availability marker." },
      { "field": "industry_region_composition", "state": "available", "notice": "Synthetic availability marker." }
    ]
  }
}
