{
  "schema_version": "class2-mock-view-v1",
  "data_version": "synthetic-fixture-v1",
  "policy_version": "development-unapproved",
  "synthetic": true,
  "development_notice": "DEVELOPMENT ONLY — synthetic fixture; not production or medical-device data.",
  "view_state": "results",
  "release_status": "suppressed_small_cell",
  "selection_summary": {
    "selections": [
      { "type": "item_group", "id": "synthetic:item-group:alpha", "label": "SYNTHETIC_ITEM_GROUP_ALPHA" },
      { "type": "item_name", "id": "synthetic:item-name:beta", "label": "SYNTHETIC_ITEM_NAME_BETA" }
    ],
    "period": { "start_month": "2099-01", "end_month": "2099-03" }
  },
  "per_item_results": [
    { "selection_id": "synthetic:item-group:alpha", "selection_type": "item_group", "release_status": "suppressed_small_cell", "notice": "Synthetic small-cell suppression state; threshold is not defined here." },
    { "selection_id": "synthetic:item-name:beta", "selection_type": "item_name", "release_status": "suppressed_small_cell", "notice": "Synthetic small-cell suppression state; threshold is not defined here." }
  ],
  "portfolio_summary": {
    "release_status": "suppressed_small_cell",
    "notice": "Portfolio values are withheld in this synthetic state."
  },
  "observed_reach": {
    "release_status": "suppressed_small_cell",
    "notice": "Observed-reach values are withheld in this synthetic state."
  },
  "coverage": {
    "release_status": "suppressed_small_cell",
    "field_states": [
      { "field": "reported_activity", "state": "suppressed", "notice": "Synthetic suppression marker." },
      { "field": "raw_supply_quantity", "state": "suppressed", "notice": "Synthetic suppression marker." },
      { "field": "supplier_recipient_counts", "state": "suppressed", "notice": "Synthetic suppression marker." },
      { "field": "industry_region_composition", "state": "suppressed", "notice": "Synthetic suppression marker." }
    ]
  }
}
